csv_files/Saving_in_Kenya_2021-2024.csv

Year,Saved any money  (% age 15+),Saved at a bank or similar financial institution  (% age 15+),Saved at a bank or similar financial institution or using a mobile money account  (% age 15+),Saved money using a mobile money account  (% age 15+),Informal ONLY,Mobile Money ONLY,Both Accounts,Traditional Bank ONLY
2021,66.7671320369555,21.4531739032776,45.0110991275483,37.2453264493391,21.76,23.56,13.69,7.77
2024,70.1941670327483,20.1488814386545,54.4225878392456,50.4706093324556,15.77,34.27,16.2,3.95

README.md

# Changing Savings Patterns in the Mobile Money Era

Although the proportion of adults saving increased modestly from **66.77% to 70.19%**, traditional bank-only savings nearly halved, declining from **7.77% to 3.95%**. Informal saving methods such as storing cash at home or participating in community savings groups also fell from **21.76% to 15.77%**.

Meanwhile, exclusive mobile money savings increased sharply from **23.56% to 34.27%**, making digital wallets the country's most widely used savings channel. Adults combining both bank accounts and mobile money also grew slightly from **13.69% to 16.20%**.